PID	WORKSPACE	Import_Index	PARENT	CMODEL	SEQUENCE	OBJ	TRANSCRPT	THUMBNAIL	Title	Alternative_Titles	Personal_Names~Roles	Corporate_Names~Roles	Abstract	Index_Date	Date_Issued	Date_Captured	Other_Date~Display_Label	Publisher	Place_Of_Publication	Public_Notes~Types	Notes~Display_Label	Dates_as_Notes~Display_Label	Citations	Table_of_Contents	LCSH_Subjects	Subjects_Names~Types	Subjects_Geographic	Subjects_Temporal	Keywords	Coordinate	Related_Items~Types	Type_of_Resource~AuthorityURI	Genre~AuthorityURI	Extent	Form~AuthorityURI	MIME_Type	Digital_Origin	Classifications~Authorities	Language_Names~Codes	Local_Identifier	Handle	Physical_Location	Shelf_Locator	Access_Condition	Import_Source	Primary_Sort	Hidden_Creator	Pull_Quotes	Private_Notes~Types
grinnell:17389	/Volumes/LIBRARY/ALLSTAFF/DG-Metadata-Review-2020-r1/grinnell-in-china/grinnell_17389_MODS.log	1	grinnell:grinnell-in-china			https://digital.grinnell.edu/islandora/object/grinnell:17389			Photo of a House with Laundry		Chapman, John Forrest ~ photographer		This photo shows a one story wood slat house with laundry strung up outside. In front of the laundry is a person, although gender is hard to discern. The person is  fanning a small stove.	1924			1924-1936 ~ Date Issued										China	1912-1928 | Republic, 1912-1949 | May Thirtieth movement, 1925 | Northern Expedition, 1926-1928 | Twentieth century | Nineteen twenties	Chinese | Chinese people | Social conditions			Still Image	Photograph	1 sheet						grinnell:17389	http://hdl.handle.net/11084/17389					99			
grinnell:17390	/Volumes/LIBRARY/ALLSTAFF/DG-Metadata-Review-2020-r1/grinnell-in-china/grinnell_17390_MODS.log	2	grinnell:grinnell-in-china			https://digital.grinnell.edu/islandora/object/grinnell:17390			Photo of Men with Broken Down Car		Chapman, John Forrest ~ photographer		The focus of this photo is an early 20th century car with a flat tire. A group of men in European clothing stand around the car on a dirt road. In the background, two young girls stand on the side of the road looking on.	1924			1924-1926 ~ Date Issued										China	1912-1928 | Republic, 1912-1949 | Warlord period, 1916-1928 | May Thirtieth movement, 1925 | Northern Expedition, 1926-1928 | Twentieth century | Nineteen twenties	American influences | Chinese | Chinese people | Missionaries | Travel | Western influences			Still Image	Photograph	1 sheet						grinnell:17390	http://hdl.handle.net/11084/17390					99			
grinnell:17391	/Volumes/LIBRARY/ALLSTAFF/DG-Metadata-Review-2020-r1/grinnell-in-china/grinnell_17391_MODS.log	3	grinnell:grinnell-in-china			https://digital.grinnell.edu/islandora/object/grinnell:17391			Photo of a Lake and Rock		Chapman, John Forrest ~ photographer		Photo of a rock formation next to a lake in China, taken by John Forrest Chapman during his time in Techow. There are seven copies of the photo included in the folder.	1924			1924-1926 ~ Date Issued										Dezhou Shi (China)	1912-1928 | Republic, 1912-1949 | Warlord period, 1916-1928 | May Thirtieth movement, 1925 | Northern Expedition, 1926-1928 | Twentieth century | Nineteen twenties	Missionaries | Travel			Still Image	Photograph	1 sheet						grinnell:17391	http://hdl.handle.net/11084/17391					99			
grinnell:17392	/Volumes/LIBRARY/ALLSTAFF/DG-Metadata-Review-2020-r1/grinnell-in-china/grinnell_17392_MODS.log	4	grinnell:grinnell-in-china			https://digital.grinnell.edu/islandora/object/grinnell:17392			Photo of Two Chinese People on a Country Road		Chapman, John Forrest ~ photographer		This photo, taken by John Forrest Chapman, shows a Chinese man and woman resting next to a dirt road. The man is wearing a conical hat and the woman has a bindle on her head. In the background is a small white memorial cross and a sign post with Chinese characters on it.	1924			1924-1926 ~ Date Issued										China	1912-1928 | Republic, 1912-1949 | Warlord period, 1916-1928 | May Thirtieth movement, 1925 | Northern Expedition, 1926-1928 | Twentieth century | Nineteen twenties	Chinese | Chinese people | Missionaries | Rural missions | Travel			Still Image	Photograph	1 sheet						grinnell:17392	http://hdl.handle.net/11084/17392					99			
grinnell:17393	/Volumes/LIBRARY/ALLSTAFF/DG-Metadata-Review-2020-r1/grinnell-in-china/grinnell_17393_MODS.log	5	grinnell:grinnell-in-china			https://digital.grinnell.edu/islandora/object/grinnell:17393			Photo of a Temple in China		Chapman, John Forrest ~ photographer		Photo of a temple and possibly a shrine in China. This photo was taken by John Forrest Chapman during his time at the North China Missionary and documents his travels around China.	1924			1924-1926 ~ Date Issued										China	1912-1928 | Republic, 1912-1949 | Warlord period, 1916-1928 | May Thirtieth movement, 1925 | Northern Expedition, 1926-1928 | Twentieth century | Nineteen twenties	Missionaries | Religious aspects | Social life and customs | Travel | Shrines | Temples			Still Image	Photograph	1 sheet						grinnell:17393	http://hdl.handle.net/11084/17393					99			
grinnell:17394	/Volumes/LIBRARY/ALLSTAFF/DG-Metadata-Review-2020-r1/grinnell-in-china/grinnell_17394_MODS.log	6	grinnell:grinnell-in-china			https://digital.grinnell.edu/islandora/object/grinnell:17394			Photo of a Forest Road in China		Chapman, John Forrest ~ photographer		Photo of a forest road in China, taken by John Forrest Chapman during his time at the North China Mission. The photo shows a coniferous forest surrounding a dirt road.	1924			1924-1926 ~ Date Issued										China	Republic, 1912-1949 | Warlord period, 1916-1928 | May Thirtieth movement, 1925 | Northern Expedition, 1926-1928 | Twentieth century | Nineteen twenties	Rural missions | Travel			Still Image	Photograph	1 sheet						grinnell:17394	http://hdl.handle.net/11084/17394					99			
grinnell:17395	/Volumes/LIBRARY/ALLSTAFF/DG-Metadata-Review-2020-r1/grinnell-in-china/grinnell_17395_MODS.log	7	grinnell:grinnell-in-china			https://digital.grinnell.edu/islandora/object/grinnell:17395			Photo of Building in Forest		Chapman, John Forrest ~ photographer		A photo of a building set against a forest in China that includes two men sitting on the curb in front of the house. This photo was taken by John Forrest Chapman during his time at the North China Mission and includes two copies.	1924			1924-1926 ~ Date Issued										China	1912-1928 | Republic, 1912-1949 | Warlord period, 1916-1928 | May Thirtieth movement, 1925 | Northern Expedition, 1926-1928 | Twentieth century | Nineteen twenties	Chinese | Chinese people | Dwellings | Missions | Rural missions | Travel			Still Image	Photograph	1 sheet						grinnell:17395	http://hdl.handle.net/11084/17395					99			
grinnell:17396	/Volumes/LIBRARY/ALLSTAFF/DG-Metadata-Review-2020-r1/grinnell-in-china/grinnell_17396_MODS.log	8	grinnell:grinnell-in-china			https://digital.grinnell.edu/islandora/object/grinnell:17396			Photo of a Buddhist Shrine		Chapman, John Forrest ~ photographer		This photo shows the inside of a Buddhist temple and shows what appears to be the main shrine inside the building. In the foreground are steps with large candles and behind are various Buddha statues. The background of the photo shows a larger wall covered with iconography and various layers of what appears to be woodworking. 2 copies are included.	1924			1924-1926 ~ Date Issued										China	Republic, 1912-1949 | Warlord period, 1916-1928 | May Thirtieth movement, 1925 | Northern Expedition, 1926-1928 | Twentieth century | Nineteen twenties	Chinese | Religious aspects | Rural missions | Social life and customs | Social values | Travel | Shrines | Temples			Still Image	Photograph	1 sheet						grinnell:17396	http://hdl.handle.net/11084/17396					99			
grinnell:17397	/Volumes/LIBRARY/ALLSTAFF/DG-Metadata-Review-2020-r1/grinnell-in-china/grinnell_17397_MODS.log	9	grinnell:grinnell-in-china			https://digital.grinnell.edu/islandora/object/grinnell:17397			Photo of Chinese Man Carrying Blankets		Chapman, John Forrest ~ photographer		This photo shows a Chinese man on a dirt road carrying blankets in a pouch on his back. He wears a European-style top hat along with white cloth pants and a shirt. The man is pictured leaning on his walking stick, taking a break from the trek.	1924			1924-1926 ~ Date Issued										China	1912-1928 | Republic, 1912-1949 | Warlord period, 1916-1928 | May Thirtieth movement, 1925 | Northern Expedition, 1926-1928 | Twentieth century | Nineteen twenties	Chinese | Chinese people | Social conditions | Rural missions | Travel			Still Image	Photograph	1 sheet						grinnell:17397	http://hdl.handle.net/11084/17397					99			
grinnell:17398	/Volumes/LIBRARY/ALLSTAFF/DG-Metadata-Review-2020-r1/grinnell-in-china/grinnell_17398_MODS.log	10	grinnell:grinnell-in-china			https://digital.grinnell.edu/islandora/object/grinnell:17398			Photo of Chinese Man Standing in Front of a Temple		Chapman, John Forrest ~ photographer		This photo shows a man dressed in white standing in front of a large, presumedly Buddhist temple. Above the temple doors is a sign with Chinese characters. The temple is very large, with stones steps in front and an ornate facade.	1924			1924-1926 ~ Date Issued										China	1912-1928 | Republic, 1912-1949 | Warlord period, 1916-1928 | May Thirtieth movement, 1925 | Northern Expedition, 1926-1928 | Twentieth century | Nineteen twenties	Chinese | Chinese language | Chinese people | Religious aspects | Social conditions | Social life and customs | Social values | Travel | Shrines | Temples			Still Image	Photograph	1 sheet						grinnell:17398	http://hdl.handle.net/11084/17398					99			
grinnell:17399	/Volumes/LIBRARY/ALLSTAFF/DG-Metadata-Review-2020-r1/grinnell-in-china/grinnell_17399_MODS.log	11	grinnell:grinnell-in-china			https://digital.grinnell.edu/islandora/object/grinnell:17399			Photo of a Small Chinese Temple		Chapman, John Forrest ~ photographer		This photo shows a smaller structure on the grounds of a Chinese temple. The structure featured in the foreground shows the side of the wall with an ornate scene painted of what looks like a river and vegetation. Surrounding the structure are small rocks, with larger ones against a different wall.	1924			1924-1926 ~ Date Issued										China	1912-1928 | Republic, 1912-1949 | Warlord period, 1916-1928 | May Thirtieth movement, 1925 | Northern Expedition, 1926-1928 | Twentieth century | Nineteen twenties	Chinese | Religious aspects | Social conditions | Social life and customs | Social values | Travel | Shrines | Temples			Still Image	Photograph	1 sheet						grinnell:17399	http://hdl.handle.net/11084/17399					99			
grinnell:17400	/Volumes/LIBRARY/ALLSTAFF/DG-Metadata-Review-2020-r1/grinnell-in-china/grinnell_17400_MODS.log	12	grinnell:grinnell-in-china			https://digital.grinnell.edu/islandora/object/grinnell:17400			Photo of a Pagoda Statue Outside a Temple		Chapman, John Forrest ~ photographer		This photo shows a tall statue of a pagoda-shaped structure in front of a larger temple. Surrounding the statue is a very short stone fence with a metal gate at the front. The temple in the background is very ornate and includes a large sign with Chinese lettering.	1924			1924-1926 ~ Date Issued										China	1912-1928 | Republic, 1912-1949 | Warlord period, 1916-1928 | May Thirtieth movement, 1925 | Northern Expedition, 1926-1928 | Twentieth century | Nineteen twenties	Chinese | Chinese language | Religious aspects | Social life and customs | Social values | Travel | Shrines | Temples			Still Image	Photograph	1 sheet						grinnell:17400	http://hdl.handle.net/11084/17400					99			
grinnell:17401	/Volumes/LIBRARY/ALLSTAFF/DG-Metadata-Review-2020-r1/grinnell-in-china/grinnell_17401_MODS.log	13	grinnell:grinnell-in-china			https://digital.grinnell.edu/islandora/object/grinnell:17401			Photo of an Entrance to Temple Grounds		Chapman, John Forrest ~ photographer		This photo shows what looks to be the entrance to grounds of a temple in China. The main focus of the photo is a pagoda type building with a walkway in the center. Looking through the walkway we can see another temple structure behind it and the walkway is flanked on either side by different temple structures.	1924			1924-1926 ~ Date Issued										China	1912-1928 | Republic, 1912-1949 | Warlord period, 1916-1928 | May Thirtieth movement, 1925 | Northern Expedition, 1926-1928 | Twentieth century | Nineteen twenties	Chinese | Religious aspects | Social conditions | Social life and customs | Social values | Travel | Temples			Still Image	Photograph	1 sheet						grinnell:17401	http://hdl.handle.net/11084/17401					99			
grinnell:17402	/Volumes/LIBRARY/ALLSTAFF/DG-Metadata-Review-2020-r1/grinnell-in-china/grinnell_17402_MODS.log	14	grinnell:grinnell-in-china			https://digital.grinnell.edu/islandora/object/grinnell:17402			Photo of the Side of a Temple		Chapman, John Forrest ~ photographer		This photo shows the side of a temple in China and the corner of a different building on the same grounds. There appear to be representations of people on the side of the temple, with three panels and one including a door. In the background we can see a hill with trees, suggesting the temple is in a more isolated, rural area.	1924			1924-1926 ~ Date Issued										China	1912-1928 | Republic, 1912-1949 | Warlord period, 1916-1928 | May Thirtieth movement, 1925 | Northern Expedition, 1926-1928 | Twentieth century | Nineteen twenties	Chinese | Religious aspects | Social conditions | Social life and customs | Social values | Travel | Temples			Still Image	Photograph	1 sheet						grinnell:17402	http://hdl.handle.net/11084/17402					99			
grinnell:17403	/Volumes/LIBRARY/ALLSTAFF/DG-Metadata-Review-2020-r1/grinnell-in-china/grinnell_17403_MODS.log	15	grinnell:grinnell-in-china			https://digital.grinnell.edu/islandora/object/grinnell:17403			Photo of a Temple Door		Chapman, John Forrest ~ photographer		This photo shows the carved wooden door of a Temple in China. The beams of the roof and the door are elaborately carved and the panels on either side of the door feature paintings. The paintings are of scenes of nature.	1924			1924-1926 ~ Date Issued										China	Republic, 1912-1949 | Warlord period, 1916-1928 | May Thirtieth movement, 1925 | Northern Expedition, 1926-1928 | Twentieth century | Nineteen twenties	Chinese | Religious aspects | Travel | Temples			Still Image	Photograph	1 sheet						grinnell:17403	http://hdl.handle.net/11084/17403					99			
grinnell:17404	/Volumes/LIBRARY/ALLSTAFF/DG-Metadata-Review-2020-r1/grinnell-in-china/grinnell_17404_MODS.log	16	grinnell:grinnell-in-china			https://digital.grinnell.edu/islandora/object/grinnell:17404			Photo of a Wooden Cart with Ox		Chapman, John Forrest ~ photographer		This photo shows a large wooden cart pulled by an ox. The ox and cart are entering a walled area, maybe a town and heading towards a cluster of two story buildings. In the background is a mountain range. The cart is packed full with cloth packages.	1924			1924-1926 ~ Date Issued										China	1912-1928 | Republic, 1912-1949 | Warlord period, 1916-1928 | May Thirtieth movement, 1925 | Northern Expedition, 1926-1928 | Twentieth century | Nineteen twenties	Chinese | Social life and customs			Still Image	Photograph	1 sheet						grinnell:17404	http://hdl.handle.net/11084/17404					99			
grinnell:17405	/Volumes/LIBRARY/ALLSTAFF/DG-Metadata-Review-2020-r1/grinnell-in-china/grinnell_17405_MODS.log	17	grinnell:grinnell-in-china			https://digital.grinnell.edu/islandora/object/grinnell:17405			Photo of Men on a Road		Chapman, John Forrest ~ photographer		This photo shows three men standing on a dirt road. None of their faces are visible as they are all looking at something one of the men is holding. One wears a European style top hat and all three are dressed in loose clothes.	1924			1924-1926 ~ Date Issued										China	1912-1928 | Republic, 1912-1949 | Warlord period, 1916-1928 | May Thirtieth movement, 1925 | Northern Expedition, 1926-1928 | Twentieth century | Nineteen twenties	Chinese | Chinese people | Travel			Still Image	Photograph	1 sheet						grinnell:17405	http://hdl.handle.net/11084/17405					99			
grinnell:17406	/Volumes/LIBRARY/ALLSTAFF/DG-Metadata-Review-2020-r1/grinnell-in-china/grinnell_17406_MODS.log	18	grinnell:grinnell-in-china			https://digital.grinnell.edu/islandora/object/grinnell:17406			Photo of a Mountain Village		Chapman, John Forrest ~ photographer		This photo shows a small village at the foothills of a mountain. A dirt road leads up to the row of buildings. There is a large amount of vegetation surrounding the village.	1924			1924-1926 ~ Date Issued										China	1912-1928 | Republic, 1912-1949 | Warlord period, 1916-1928 | May Thirtieth movement, 1925 | Northern Expedition, 1926-1928 | Twentieth century | Nineteen twenties	Chinese | Rural missions			Still Image	Photograph	1 sheet						grinnell:17406	http://hdl.handle.net/11084/17406					99			
grinnell:17407	/Volumes/LIBRARY/ALLSTAFF/DG-Metadata-Review-2020-r1/grinnell-in-china/grinnell_17407_MODS.log	19	grinnell:grinnell-in-china			https://digital.grinnell.edu/islandora/object/grinnell:17407			Photo of a Person Carrying a Bundle of Sticks		Chapman, John Forrest ~ photographer		This photo shows a person carrying a large bundle of sticks over their head. The gender of the subject isn't clear. The person is barefoot and wearing a long white skirt and white shirt.	1924			1924-1926 ~ Date Issued										China	1912-1928 | Republic, 1912-1949 | Warlord period, 1916-1928 | May Thirtieth movement, 1925 | Northern Expedition, 1926-1928 | Twentieth century | Nineteen twenties	Chinese | Chinese people | Social life and customs			Still Image	Photograph	1 sheet						grinnell:17407	http://hdl.handle.net/11084/17407					99			
grinnell:17408	/Volumes/LIBRARY/ALLSTAFF/DG-Metadata-Review-2020-r1/grinnell-in-china/grinnell_17408_MODS.log	20	grinnell:grinnell-in-china			https://digital.grinnell.edu/islandora/object/grinnell:17408			Photo of a Stone Outcrop		Chapman, John Forrest ~ photographer		This photo shows a rock outcropping in the middle of a forested mountain range. Trees cover the side of the mountains and the top of the rock. In the background is a taller mountain.	1924			1924-1926 ~ Date Issued										China	1912-1928 | Republic, 1912-1949 | Warlord period, 1916-1928 | May Thirtieth movement, 1925 | Northern Expedition, 1926-1928 | Twentieth century | Nineteen twenties	Chinese | Travel			Still Image	Photograph	1 sheet						grinnell:17408	http://hdl.handle.net/11084/17408					99			
grinnell:17409	/Volumes/LIBRARY/ALLSTAFF/DG-Metadata-Review-2020-r1/grinnell-in-china/grinnell_17409_MODS.log	21	grinnell:grinnell-in-china			https://digital.grinnell.edu/islandora/object/grinnell:17409			Photo of Small Shrines		Chapman, John Forrest ~ photographer		This photos shows ten small stone shrines at the base of a mountain. They vary in height, but all feature a pointed top. The surrounding environment is very highly vegetated.	1924			1924-1926 ~ Date Issued										China	1912-1928 | Republic, 1912-1949 | Warlord period, 1916-1928 | May Thirtieth movement, 1925 | Northern Expedition, 1926-1928 | Twentieth century | Nineteen twenties	Chinese | Religious aspects | Shrines			Still Image	Photograph	1 sheet						grinnell:17409	http://hdl.handle.net/11084/17409					99			
grinnell:17410	/Volumes/LIBRARY/ALLSTAFF/DG-Metadata-Review-2020-r1/grinnell-in-china/grinnell_17410_MODS.log	22	grinnell:grinnell-in-china			https://digital.grinnell.edu/islandora/object/grinnell:17410			Photo of Small Religious Structure		Chapman, John Forrest ~ photographer		This photo shows a roadside wooden structure. Elaborately carved with a stone tablet, like a gravestone, in the middle under a roof. The stone tablet has a line of Chinese characters down the middle.	1924			1924-1926 ~ Date Issued										China	1912-1928 | Republic, 1912-1949 | Warlord period, 1916-1928 | May Thirtieth movement, 1925 | Northern Expedition, 1926-1928 | Twentieth century | Nineteen twenties	Chinese | Religious aspects | Travel | Shrines			Still Image	Photograph	1 sheet						grinnell:17410	http://hdl.handle.net/11084/17410					99			
grinnell:17411	/Volumes/LIBRARY/ALLSTAFF/DG-Metadata-Review-2020-r1/grinnell-in-china/grinnell_17411_MODS.log	23	grinnell:grinnell-in-china			https://digital.grinnell.edu/islandora/object/grinnell:17411			Photo of Temple		Chapman, John Forrest ~ photographer		This photo shows a temple with a tall stone shrine in front of it. A series of steps leads up to the temple and it is surrounded by trees. In the background is a mountain and in the foreground there's a group of western-clothed men below the steps.	1924			1924-1926 ~ Date Issued										China	1912-1928 | Republic, 1912-1949 | Warlord period, 1916-1928 | May Thirtieth movement, 1925 | Northern Expedition, 1926-1928 | Twentieth century | Nineteen twenties	American influences | Chinese | Chinese people | Religious aspects | Social life and customs | Social values | Travel | Shrines | Temples			Still Image	Photograph	1 sheet						grinnell:17411	http://hdl.handle.net/11084/17411					99			
grinnell:17412	/Volumes/LIBRARY/ALLSTAFF/DG-Metadata-Review-2020-r1/grinnell-in-china/grinnell_17412_MODS.log	24	grinnell:grinnell-in-china			https://digital.grinnell.edu/islandora/object/grinnell:17412			Harold Matthews's Letter Home - August 31, 1949		Matthews, Harold S. | Matthews, Harold S.		Harold's personal experience with the CPC (Communist Party of China) occupation/liberation of Foochow/Fuzhou, China.	1949	1949-08-31			Grinnell College									China	1946-1950 (Chinese Civil War)	Politics and Government | War | Communist Takeover | Correspondence		Digital Grinnell ~ host	text	letter	1 page w/ envelope		application/pdf		MS 01.130.01 Box 1 Folder 7 ~ local	English ~ eng	grinnell:17412	http://hdl.handle.net/11084/17412			Copyright to this work is held by the author(s), in accordance with United            States copyright law (USC 17). Readers of this work have certain rights as defined by            the law, including but not limited to fair use (17 USC 107 et seq.).		99			
grinnell:17413	/Volumes/LIBRARY/ALLSTAFF/DG-Metadata-Review-2020-r1/grinnell-in-china/grinnell_17413_MODS.log	25	grinnell:grinnell-in-china			https://digital.grinnell.edu/islandora/object/grinnell:17413			Harold Matthews's Letter Home - May 11, 1945		Matthews, Harold S. | Matthews, Harold S.		Harold talks about his WW experience in Europe.	1945	1945-05-11			Grinnell College									Europe	Twentieth century	War victims		Digital Grinnell ~ host	text		3 pages					English ~ eng	grinnell:17413	http://hdl.handle.net/11084/17413			Copyright to this work is held by the author(s), in accordance with United            States copyright law (USC 17). Readers of this work have certain rights as defined by            the law, including but not limited to fair use (17 USC 107 et seq.).		99			
