PID	WORKSPACE	Import_Index	PARENT	CMODEL	SEQUENCE	OBJ	TRANSCRPT	THUMBNAIL	Title	Alternative_Titles	Personal_Names~Roles	Corporate_Names~Roles	Abstract	Index_Date	Date_Issued	Date_Captured	Other_Date~Display_Label	Publisher	Place_Of_Publication	Public_Notes~Types	Notes~Display_Label	Dates_as_Notes~Display_Label	Citations	Table_of_Contents	LCSH_Subjects	Subjects_Names~Types	Subjects_Geographic	Subjects_Temporal	Keywords	Coordinate	Related_Items~Types	Type_of_Resource~AuthorityURI	Genre~AuthorityURI	Extent	Form~AuthorityURI	MIME_Type	Digital_Origin	Classifications~Authorities	Language_Names~Codes	Local_Identifier	Handle	Physical_Location	Shelf_Locator	Access_Condition	Import_Source	Primary_Sort	Hidden_Creator	Pull_Quotes	Private_Notes~Types
grinnell:17439	/Volumes/LIBRARY/ALLSTAFF/DG-Metadata-Review-2020-r1/grinnell-in-china/grinnell_17439_MODS.log	26	grinnell:grinnell-in-china			https://digital.grinnell.edu/islandora/object/grinnell:17439			Excerpts from letters from China 1916-1948		Reed, Alice ~ Author		This typed reproduction of letters sent from Grinnell in China participant Alice Reed to her family back in the United States contains correspondence from the beginning of her tenure in 1916 to her journey back to the US in 1948. These letters are bound together and begin with a foreword written by Alice in the 60’s. In this foreword, she describes how she came to the Grinnell in China program and the prospect of going to the “new Republic of China.” This foreword introduces Alice’s life, which after 1916 was carefully documented in her letters home. Also included are two maps at the end of the book, one of China and another of Alice's travels around the world. Alice describes her journey to China in September of 1916 after joining the Grinnell in China Mission at the age of 26. She sails first to Nagasaki in Japan and then on to Techow, China to work at the North China Anglican Mission. Alice travels throughout China, Europe, India, and Africa, all the while tracing her movements throughout the world through her letters. Her encounters with Chinese rebels, military, and communists during this tumultuous time in Chinese history are all recorded with details on the movements of the groups and their effect on the population. During the Second World War, Alice is forced to leave China for the United States in December of 1942. She eventually returns to teach at a different school in Chengtu until leaving China permanently in 1948 in response to growing unrest.  Included in her narrative are the details of her fellow missionaries as they live and work together. Alfred and Irma Heininger and their family are mentioned throughout the letters, as well as Harold and Grace Matthews. Also included are Ruth Tollman, the Miles family, Dr. Emma Tucker, the MacEachron family, the Cady family, the Robinson family, the Child family, the Arnold family, Lucy Mead, Adelle Tenney, Lucia Lyons, and a large number of other people during her 32 year stay in China.  Ms. Reed is in Techow during the Sun Yat Sen revolution, World War I, the Communist Uprising, the beginning stages of World War II, and the beginning of the Communist Revolution. Throughout all of these events, Ms. Reed teaches in two missionary schools, one in Techow and another in Chengtu. She moves to Chengtu following her return to China in 1944, once WWII permits travel to the country. As fighting comes to Techow during the Sun Yat Sen movement, the Japanese invasion, and the Communist Revolution, Reed details the efforts made by the missionaries to provide adequate medical care and shelter to the affected population. When the Japanese occupy China during the late 30’s, Reed notes the political and social changes that affect the school and her pupils.  A larger aspect of Reed’s time as a missionary was her ability to travel. Her 32-year tenure as a missionary was a unique chance for exposure to the larger world and Reed takes advantage of the Furloughs and other gaps in missionary work to travel a large portion of that world. She travels to Japan, Peitaiho, Peking, Nanking, Shanghai, Siberia, Moscow, Warsaw, Berlin, Montreaux, Interlaken, Paris, London, Liverpool, Montreal, Sumatra, Madagascar, Rio de Janeiro, Portugal, and India. As war breaks out between Japan and the United States, the Americans at the mission are sent home on a boat manned by the Japanese. This journey took the Americans through Sumatra, Java, Mozambique, and ended with the exchange of American and Japanese nationals in Rio de Janeiro. Once Alice returns in 1944, the situation in China only continues to worsen and the missionaries are unable to return to Techow due to the communist occupation. After hoping to move to Sian to teach at the Jefferson Academy, it becomes apparent that she will not be able to move there due to her status as a woman. As such, Alice begins teaching in the English Department at Cheeloo University. Many of her students in Chengtu are refugees from the Japanese, having been so anywhere from 1-7 years. As fighting between the communists and Japanese worsens, most of Shansi Province is put under Martial law. It soon becomes obvious that the communists may capture Chengtu and the American consul advises citizens in 1948 to evacuate the area. Alice Reed leaves China for the last time on November 16, 1948. She returns to the United States for two years, living in Syracuse and Oberlin, helping to care for her mother. After these two years, Reed goes to Uskudar, Turkey to teach at the American School for Girls. She returns to the United States permanently in 1959, moving to Syracuse until 1963 when she retires at the Pilgrim Place Retirement Community in Claremont, California.	1916	1966		1916-1948- Years on letters ~ Date (Other)										Dezhou Shi (China) | Beijing (China) | Forbidden City (Beijing, China) | China | Mongolia	1912-1928 | Republic, 1912-1949 | Warlord period, 1916-1928 | Movement to Protect the Constitution, 1917-1923 | Qing Dynasty Restoration Attempt, 1917 | May Fourth movement, 1919 | May Thirtieth movement, 1925 | Northern Expedition, 1926-1928 | 1928-1937 (Sino-Japanese Conflict) | 1937-1945 (Sino-Japanese War) | Civil War, 1945-1949 | Twentieth century | Nineteen tens | Nineteen twenties | Nineteen thirties | Nineteen forties	American influences | Adult education | Agricultural education | Attitudes | Basic education | Books and reading | Chinese | Chinese language | Chinese New Year | Chinese people | Chinese students | Christian education | Christianity | City missions | Classrooms | Communism | Demonstrations | Dormitories | Dormitory life | Education | Education (Elementary) | Education (Higher) | Education (Secondary) | Education of boys | Education of girls | English influences | English language | Famines | Footbinding | Missionaries | Missions | Political activity | Politics and Government | Religious aspects | Social conditions | Rural missions | Social life and customs | Social values | Travel | Palaces | Values | Parades | Political refugees | Public meetings | Public officers | Refugees | Riots | School buildings | School discipline | Shrines | Social gospel | Student strikes | Taoism | Western influences | War victims | Temples			Text	Correspondence (group of letters ingested as a compound)	258 pages						grinnell:17439	http://hdl.handle.net/11084/17439					99			
grinnell:18743	/Volumes/LIBRARY/ALLSTAFF/DG-Metadata-Review-2020-r1/grinnell-in-china/grinnell_18743_MODS.log	27	grinnell:grinnell-in-china			https://digital.grinnell.edu/islandora/object/grinnell:18743			Building Next to Pond		Chapman, John Forrest ~ creator | Carhart, Louise '17 ~ Contributor		This still photo shows an ornate building, possibly on temple grounds, on the bank of a large pond. The building is supported by large columns and topped by an elaborate roof. In the background we can see faint mountains, suggesting a rural setting.	1924			1924-1926 ~ Approx. Date of Creation								Chinese | Social life and customs | Travel		China	1912-1928 | Republic, 1912-1949 | Warlord period, 1916-1928 | May Thirtieth movement, 1925 | Northern Expedition, 1926-1928 | Twentieth century | Nineteen twenties			Digital Grinnell ~ host	Still Image	Photograph	8 sheets		image/tiff	digitized other analog			grinnell:18743	http://hdl.handle.net/11084/18743					99			
grinnell:18744	/Volumes/LIBRARY/ALLSTAFF/DG-Metadata-Review-2020-r1/grinnell-in-china/grinnell_18744_MODS.log	28	grinnell:grinnell-in-china			https://digital.grinnell.edu/islandora/object/grinnell:18744			Two Men in Hats		Chapman, John Forrest ~ creator | Carhart, Louise '17 ~ Contributor		This still photo shows two men wearing hats on a dirt road. Both wear the same white, loose clothing and one carries a walking stick. On the left, the man wear a large, conical straw hat while the man on the right is wearing a more European style top hat.	1924			1924-1926 ~ Approx. Date of Creation								Chinese | Chinese people | Social conditions | Social life and customs | Travel		China	1912-1928 | Republic, 1912-1949 | Warlord period, 1916-1928 | May Thirtieth movement, 1925 | Northern Expedition, 1926-1928 | Twentieth century | Nineteen twenties			Digital Grinnell ~ host	Still Image	Photograph	7 sheets		image/tiff	digitized other analog			grinnell:18744	http://hdl.handle.net/11084/18744					99			
grinnell:18745	/Volumes/LIBRARY/ALLSTAFF/DG-Metadata-Review-2020-r1/grinnell-in-china/grinnell_18745_MODS.log	29	grinnell:grinnell-in-china			https://digital.grinnell.edu/islandora/object/grinnell:18745			The Grinnell-China Educational Movement		Ge, Lily ’17 ~ editor	Grinnell-China Movement Committee ~ creator	A brief report about Grinnell-in-China that summarizes its initial founding, current operation strategies, and future plans. There are two maps included that show where the Grinnell-in-China district is.	1900			Early 1900s ~ Approx. Date of Creation	Grinnell College							American influences | Adult education | Attitudes | Chinese people | Chinese students | Christian education | Christianity | City missions | Education | Education (Elementary) | Education (Higher) | Education (Secondary) | Education of boys | Education of girls | English language | Missionaries | Missionaries, Medical | Missions | Religious aspects | Values | School buildings | Western influences		Shandong Sheng	Twentieth century | Nineteen tens			Digital Grinnell ~ host	text	report	4 pages		application/pdf	digitized other analog		English ~ eng	grinnell:18745	http://hdl.handle.net/11084/18745			Copyright to this work is held by the author(s), in accordance with United            States copyright law (USC 17). Readers of this work have certain rights as defined by            the law, including but not limited to fair use (17 USC 107 et seq.).		99			
grinnell:18746	/Volumes/LIBRARY/ALLSTAFF/DG-Metadata-Review-2020-r1/grinnell-in-china/grinnell_18746_MODS.log	30	grinnell:grinnell-in-china			https://digital.grinnell.edu/islandora/object/grinnell:18746			Porter Middle School		Matthews, Harold S. ~ creator | Ge, Lily ’17 ~ editor		A report written by Harold Matthews about Porter Middle School. It contains information about the history of the school, present plans and happenings, and future aims and needs.	1920			1920s	Grinnell College							American influences | Chinese | Chinese people | Chinese students | Christian education | Christianity | Dormitories | Education | Education (Higher) | Education (Secondary) | Education of boys | Education of girls | English language | Examinations | Missionaries | Religious aspects | Values | School buildings | Western influences		Techow	Nineteen twenties			Digital Grinnell ~ host	text	report	2 pages 2 copies		application/pdf	digitized other analog		English ~ eng	grinnell:18746	http://hdl.handle.net/11084/18746			Copyright to this work is held by the author(s), in accordance with United            States copyright law (USC 17). Readers of this work have certain rights as defined by            the law, including but not limited to fair use (17 USC 107 et seq.).		99			
grinnell:18747	/Volumes/LIBRARY/ALLSTAFF/DG-Metadata-Review-2020-r1/grinnell-in-china/grinnell_18747_MODS.log	31	grinnell:grinnell-in-china			https://digital.grinnell.edu/islandora/object/grinnell:18747			Grinnell Missionaries in China		Turner, E. S. ~ creator | Choo, Mona '17		A letter written by E.S. Turner about his vacation to China with his wife. He talks about his experiences traveling and his initial impressions from visiting the Grinnell-in-China field in Techow.	1917			18-Jul-17	Grinnell College							American influences | Attitudes | School buildings		China	18-Jul-17			Digital Grinnell ~ host	text	clipping	2 sheets		application/pdf	digitized other analog		English ~ eng	grinnell:18747	http://hdl.handle.net/11084/18747			Copyright to this work is held by the author(s), in accordance with United            States copyright law (USC 17). Readers of this work have certain rights as defined by            the law, including but not limited to fair use (17 USC 107 et seq.).		99			
grinnell:18748	/Volumes/LIBRARY/ALLSTAFF/DG-Metadata-Review-2020-r1/grinnell-in-china/grinnell_18748_MODS.log	32	grinnell:grinnell-in-china			https://digital.grinnell.edu/islandora/object/grinnell:18748			Letter from Harold S. Matthews to Paul		Matthews, Harold S. ~ creator | Simmer, Lian ’18 ~ editor		A letter written by Harold Matthews about the departure of three Grinnell-In-China leaders. He wonders whether Grinnell-In-China will open in the fall and speculates about the school's finances.	1925			1925	Grinnell College							Basic education | Education | Education (Elementary) | Education (Higher) | Education (Secondary) | Finances | Examinations		China	1912-1928 | Republic, 1912-1949 | Warlord period, 1916-1928 | Twentieth century | Nineteen twenties			Digital Grinnell ~ host	text	letter	1 page		image/tiff	digitized other analog		English ~ eng	grinnell:18748	http://hdl.handle.net/11084/18748			Copyright to this work is held by the author(s), in accordance with United            States copyright law (USC 17). Readers of this work have certain rights as defined by            the law, including but not limited to fair use (17 USC 107 et seq.).		99			
grinnell:18749	/Volumes/LIBRARY/ALLSTAFF/DG-Metadata-Review-2020-r1/grinnell-in-china/grinnell_18749_MODS.log	33	grinnell:grinnell-in-china			https://digital.grinnell.edu/islandora/object/grinnell:18749			Letter from Harold S. Matthews to James Findley		Matthews, Harold S. ~ creator | Simmer, Lian ’18 ~ editor		A letter from Harold S. Matthews addressed to Mr. Findley. Matthews praises Findley for his promotion and worries about whether Grinnell will send money to Porter-Wyckoff School in time to pay the bills.	1925			1925	Grinnell College							Basic education | Education | Finances		China	1912-1928 | Republic, 1912-1949 | Warlord period, 1916-1928 | Twentieth century | Nineteen twenties			Digital Grinnell ~ host	text	letter	1 page		image/tiff	digitized other analog		English ~ eng	grinnell:18749	http://hdl.handle.net/11084/18749			Copyright to this work is held by the author(s), in accordance with United            States copyright law (USC 17). Readers of this work have certain rights as defined by            the law, including but not limited to fair use (17 USC 107 et seq.).		99			
grinnell:5117	/Volumes/LIBRARY/ALLSTAFF/DG-Metadata-Review-2020-r1/grinnell-in-china/grinnell_5117_MODS.log	34	grinnell:grinnell-in-china	islandora:sp_large_image_cmodel		https://digital.grinnell.edu/islandora/object/grinnell:5117			Calligraphy		J | Robertson | Robertson, J ~ author		Photo of calligraphy practice					Grinnell College									Grinnell (Iowa)		calligraphy		Poweshiek History Preservation Project ~ host	Photograph						s6b6f11 ~ ddc	English ~ eng	grinnell:5117	http://hdl.handle.net/11084/5117			Copyright to this work is held by the author(s), in accordance with United States copyright law (USC 17). Readers of this work have certain rights as defined by the law, including but not limited to fair use (17 USC 107 et seq.).		99			
